{
  "schemaVersion": 1,
  "id": "grechka-s-myasom",
  "version": 1,
  "title": "Гречка с мясом",
  "description": "Гречка по-купечески: рассыпчатая крупа, томлёная с говядиной, луком и морковью в одной кастрюле.",
  "tags": ["ужин", "говядина", "гречка"],
  "servings": 4,
  "totalTimeMin": 90,
  "ingredients": [
    { "id": "beef", "name": "говядина, лопатка или шея", "amount": 500, "unit": "g" },
    { "id": "buckwheat", "name": "гречка ядрица", "amount": 250, "unit": "g" },
    { "id": "water_stew", "name": "вода для тушения мяса", "amount": 200, "unit": "ml" },
    { "id": "water_grain", "name": "вода для гречки", "amount": 400, "unit": "ml" },
    { "id": "onion", "name": "луковица средняя", "amount": 2, "unit": "pcs" },
    { "id": "carrot", "name": "морковь средняя", "amount": 1, "unit": "pcs" },
    { "id": "garlic", "name": "зубчик чеснока", "amount": 2, "unit": "pcs" },
    { "id": "tomato_paste", "name": "томатная паста", "amount": 1, "unit": "tbsp" },
    { "id": "oil", "name": "масло растительное", "amount": 3, "unit": "tbsp", "scalable": false },
    { "id": "salt", "name": "соль", "amount": 1, "unit": "tsp" },
    { "id": "pepper", "name": "перец чёрный молотый", "amount": 0.5, "unit": "tsp" },
    { "id": "bayleaf", "name": "лавровый лист", "amount": 2, "unit": "pcs", "scalable": false },
    { "id": "butter", "name": "масло сливочное", "amount": 1, "unit": "tbsp" }
  ],
  "steps": [
    {
      "id": "s1",
      "title": "Подготовить продукты",
      "text": "Мясо ({beef}) нарезать кубиками два-три сантиметра. Лук ({onion}) мелко нарезать или натереть на крупной тёрке — тогда он растворится в блюде. Морковь ({carrot}) натереть на крупной тёрке. Гречку перебрать и промыть до прозрачной воды."
    },
    {
      "id": "s2",
      "title": "Обжарить мясо",
      "text": "В толстостенной кастрюле или казане разогреть растительное масло ({oil}). Выложить мясо в один слой и обжарить на сильном огне до румяной корочки со всех сторон.",
      "timerSec": 420
    },
    {
      "id": "s3",
      "title": "Добавить овощи",
      "text": "Убавить огонь до среднего, добавить лук и морковь. Жарить, помешивая, пока лук не станет мягким и золотистым.",
      "timerSec": 360
    },
    {
      "id": "s4",
      "title": "Потушить мясо",
      "text": "Добавить томатную пасту ({tomato_paste}), раздавленный чеснок ({garlic}), лавровый лист ({bayleaf}), соль ({salt}) и перец ({pepper}). Влить воду ({water_stew}), накрыть крышкой и тушить на слабом огне, пока мясо не станет мягким. Если вода выкипает — подливать понемногу.",
      "timerSec": 2400
    },
    {
      "id": "s5",
      "title": "Добавить гречку",
      "text": "Всыпать гречку ({buckwheat}), разровнять и влить воду ({water_grain}). Довести до кипения, не перемешивая."
    },
    {
      "id": "s6",
      "title": "Томить под крышкой",
      "text": "Убавить огонь до минимума, накрыть крышкой и томить, пока вся жидкость не впитается. Крышку не открывать.",
      "timerSec": 1200
    },
    {
      "id": "s7",
      "title": "Дать настояться",
      "text": "Снять с огня, положить сверху сливочное масло ({butter}), укутать кастрюлю полотенцем и дать постоять. Перед подачей перемешать снизу вверх.",
      "timerSec": 600
    }
  ],
  "notes": "Для нежирного варианта брать лопатку и срезать плёнки и жир. Говядину можно заменить свининой — тушить 25–30 минут — или курицей, 15 минут. Пропорция гречки и воды 1:2. В конце можно добавить свежую зелень.",
  "createdAt": "2026-09-08",
  "updatedAt": "2026-09-08",
  "source": "claude-chat"
}
