{
  "schemaVersion": 1,
  "id": "indejka-s-ovoshchami-v-duhovke",
  "version": 1,
  "title": "Индейка с овощами в духовке",
  "description": "Филе индейки и овощи на одном противне, без обжарки.",
  "tags": ["ужин", "индейка", "духовка"],
  "servings": 4,
  "totalTimeMin": 60,
  "ingredients": [
    { "id": "turkey", "name": "филе индейки", "amount": 600, "unit": "g" },
    { "id": "potato", "name": "картофель средний", "amount": 4, "unit": "pcs" },
    { "id": "carrot", "name": "морковь средняя", "amount": 2, "unit": "pcs" },
    { "id": "zucchini", "name": "кабачок средний", "amount": 1, "unit": "pcs" },
    { "id": "oil", "name": "масло оливковое", "amount": 2, "unit": "tbsp", "scalable": false },
    { "id": "paprika", "name": "паприка молотая", "amount": 1, "unit": "tsp" },
    { "id": "salt", "name": "соль", "amount": 1, "unit": "tsp" },
    { "id": "water", "name": "вода для противня", "amount": 100, "unit": "ml", "scalable": false },
    { "id": "pepper", "name": "перец чёрный молотый", "unit": "to_taste" }
  ],
  "steps": [
    {
      "id": "s1",
      "title": "Разогреть духовку",
      "text": "Включите духовку на 190 °C и дайте ей прогреться.",
      "timerSec": 900
    },
    {
      "id": "s2",
      "title": "Нарезать овощи",
      "text": "Нарежьте картофель ({potato}) крупными дольками, морковь ({carrot}) — толстыми кружками, кабачок ({zucchini}) — полукольцами."
    },
    {
      "id": "s3",
      "title": "Замариновать индейку",
      "text": "Нарежьте филе индейки ({turkey}) кусками по три сантиметра, посыпьте паприкой ({paprika}) и солью ({salt}), полейте оливковым маслом ({oil}) и оставьте на десять минут.",
      "timerSec": 600
    },
    {
      "id": "s4",
      "title": "Запекать",
      "text": "Выложите индейку и овощи на противень одним слоем, влейте воду ({water}), поперчите ({pepper}) и запекайте 35 минут.",
      "timerSec": 2100
    },
    {
      "id": "s5",
      "title": "Дать отдохнуть",
      "text": "Достаньте противень, накройте фольгой и дайте постоять десять минут перед подачей.",
      "timerSec": 600
    }
  ],
  "notes": "",
  "createdAt": "2026-08-30",
  "updatedAt": "2026-08-30",
  "source": "claude-chat"
}
