{
  "schemaVersion": 1,
  "id": "borshch-klassicheskiy",
  "version": 1,
  "title": "Борщ классический",
  "description": "Наваристый борщ на говяжьем бульоне с ярким свекольным цветом.",
  "tags": ["суп", "говядина", "обед"],
  "servings": 6,
  "totalTimeMin": 150,
  "ingredients": [
    { "id": "beef", "name": "говядина на кости, грудинка или голяшка", "amount": 500, "unit": "g" },
    { "id": "water", "name": "вода для бульона", "amount": 2.5, "unit": "l", "scalable": false },
    { "id": "beet", "name": "свёкла средняя", "amount": 2, "unit": "pcs" },
    { "id": "potato", "name": "картофель средний", "amount": 4, "unit": "pcs" },
    { "id": "cabbage", "name": "капуста белокочанная", "amount": 300, "unit": "g" },
    { "id": "carrot", "name": "морковь крупная", "amount": 1, "unit": "pcs" },
    { "id": "onion", "name": "лук репчатый", "amount": 1, "unit": "pcs" },
    { "id": "tomato_paste", "name": "томатная паста", "amount": 2, "unit": "tbsp" },
    { "id": "oil", "name": "масло растительное", "amount": 3, "unit": "tbsp", "scalable": false },
    { "id": "vinegar", "name": "уксус 9 процентов", "amount": 1, "unit": "tbsp" },
    { "id": "sugar", "name": "сахар", "amount": 1, "unit": "tsp" },
    { "id": "bayleaf", "name": "лавровый лист", "amount": 2, "unit": "pcs", "scalable": false },
    { "id": "garlic", "name": "зубчик чеснока", "amount": 3, "unit": "pcs" },
    { "id": "sour_cream", "name": "сметана для подачи", "amount": 200, "unit": "g" },
    { "id": "salt", "name": "соль", "unit": "to_taste" },
    { "id": "pepper", "name": "перец чёрный молотый", "unit": "to_taste" },
    { "id": "greens", "name": "зелень свежая", "unit": "to_taste" }
  ],
  "steps": [
    {
      "id": "s1",
      "title": "Сварить бульон",
      "text": "Залейте говядину ({beef}) холодной водой ({water}), доведите до кипения и снимите пену. Варите на слабом огне под крышкой полтора часа.",
      "timerSec": 5400
    },
    {
      "id": "s2",
      "title": "Подготовить овощи",
      "text": "Пока варится бульон, натрите на крупной тёрке свёклу ({beet}) и морковь ({carrot}), нашинкуйте капусту ({cabbage}), нарежьте лук ({onion}) кубиками, а картофель ({potato}) — брусочками."
    },
    {
      "id": "s3",
      "title": "Потушить свёклу",
      "text": "Разогрейте половину растительного масла ({oil}), выложите свёклу, добавьте томатную пасту ({tomato_paste}), уксус ({vinegar}) и сахар ({sugar}). Тушите на среднем огне под крышкой 15 минут — уксус сохранит яркий цвет.",
      "timerSec": 900
    },
    {
      "id": "s4",
      "title": "Сделать зажарку",
      "text": "Обжарьте лук до прозрачности, добавьте морковь и жарьте ещё семь минут. Если сковорода одна, переложите готовую свёклу в миску и жарьте на той же — мыть не нужно.",
      "timerSec": 420
    },
    {
      "id": "s5",
      "title": "Добавить картофель",
      "text": "Достаньте мясо, отделите от кости и нарежьте кусочками. В кипящий бульон положите картофель и варите 10 минут.",
      "timerSec": 600
    },
    {
      "id": "s6",
      "title": "Добавить капусту",
      "text": "Добавьте капусту и варите ещё 10 минут.",
      "timerSec": 600
    },
    {
      "id": "s7",
      "title": "Соединить всё",
      "text": "Верните мясо в кастрюлю, добавьте тушёную свёклу и зажарку. Варите семь минут на слабом огне.",
      "timerSec": 420
    },
    {
      "id": "s8",
      "title": "Настоять",
      "text": "Добавьте лавровый лист ({bayleaf}) и продавленный чеснок ({garlic}), посолите ({salt}) и поперчите ({pepper}). Снимите с огня и дайте настояться под крышкой 25 минут.",
      "timerSec": 1500
    },
    {
      "id": "s9",
      "title": "Подача",
      "text": "Разлейте по тарелкам, добавьте сметану ({sour_cream}) и зелень ({greens}). Хорошо идёт с чёрным хлебом или пампушками с чесноком."
    }
  ],
  "notes": "На следующий день борщ становится только вкуснее. Уксус можно заменить лимонным соком. Для постного варианта варите овощи просто в воде — общее время сократится примерно до 40 минут.",
  "createdAt": "2026-08-30",
  "updatedAt": "2026-08-30",
  "source": "claude-chat"
}
