{
  "schemaVersion": 1,
  "id": "chicken-thighs-honey-soy-airfryer",
  "version": 1,
  "title": "Куриные бедра в медово-соевой глазури",
  "description": "Бедра с хрустящей кожей и блестящей карамельной коркой, приготовленные в аэрогриле.",
  "tags": ["курица", "аэрогриль", "ужин", "маринад"],
  "servings": 3,
  "totalTimeMin": 190,
  "ingredients": [
    { "id": "chicken", "name": "куриное бедро с кожей и костью, по 150–180 г", "amount": 6, "unit": "pcs" },
    { "id": "soy", "name": "соевый соус", "amount": 6, "unit": "tbsp" },
    { "id": "honey", "name": "мёд", "amount": 3, "unit": "tbsp" },
    { "id": "garlic", "name": "зубчик чеснока", "amount": 5, "unit": "pcs" },
    { "id": "ginger", "name": "имбирь свежий тёртый, по желанию", "amount": 1.5, "unit": "tsp" },
    { "id": "lemon", "name": "лимонный сок", "amount": 1.5, "unit": "tbsp" },
    { "id": "oil", "name": "масло растительное", "amount": 1.5, "unit": "tbsp" },
    { "id": "pepper", "name": "перец чёрный молотый", "amount": 0.75, "unit": "tsp" },
    { "id": "sesame", "name": "кунжут, по желанию", "amount": 1, "unit": "tbsp" },
    { "id": "green_onion", "name": "перо зелёного лука, по желанию", "amount": 2, "unit": "pcs" }
  ],
  "steps": [
    {
      "id": "s1",
      "title": "Подготовь бедра",
      "text": "Обсуши бедра ({chicken}) бумажным полотенцем — сухая кожа потом лучше хрустит. С мясной стороны сделай по два надреза до кости: так бедра прожарятся быстрее и ровнее, а маринад пройдёт вглубь."
    },
    {
      "id": "s2",
      "title": "Сделай маринад",
      "text": "Смешай соевый соус ({soy}), мёд ({honey}), чеснок через пресс ({garlic}), имбирь ({ginger}), лимонный сок ({lemon}), масло ({oil}) и перец ({pepper}). Отлей треть в чистую чашку: это глазурь для смазывания. Соль не нужна, соевый соус даёт достаточно."
    },
    {
      "id": "s3",
      "title": "Замаринуй",
      "text": "Сложи бедра в zip-пакет, влей оставшийся маринад, выдави воздух и промассируй, чтобы маринад попал в надрезы. Убери в холодильник: минимум 30 минут, лучше 2–4 часа, максимум 12. Пару раз переверни пакет. Если вместо пакета миска — стекло, керамика или нержавейка, не алюминий.",
      "timerSec": 7200
    },
    {
      "id": "s4",
      "title": "Достань из холодильника",
      "text": "За 20–30 минут до готовки достань бедра из холодильника — холодные готовятся дольше и неравномерно.",
      "timerSec": 1500
    },
    {
      "id": "s5",
      "title": "Разогрей аэрогриль",
      "text": "Разогрей аэрогриль до 190 °C, около трёх минут. Выше нельзя — мёд сгорит.",
      "timerSec": 180
    },
    {
      "id": "s6",
      "title": "Кожей вниз",
      "text": "Стряхни с бедер лишний маринад, кожу промокни. Выложи кожей вниз в один слой, не внахлёст — иначе кожа не зарумянится. Готовь 12 минут.",
      "timerSec": 720
    },
    {
      "id": "s7",
      "title": "Переверни и глазируй",
      "text": "Переверни бедра кожей вверх и смажь половиной отложенной глазури. Готовь ещё 10–12 минут, за три минуты до конца смажь остатком — получится блестящая карамельная корка. Готовность: сок при проколе у кости прозрачный, по термометру — 74 °C у кости. Крупным бедрам добавь 3–4 минуты.",
      "timerSec": 660
    },
    {
      "id": "s8",
      "title": "Дай отдохнуть",
      "text": "Выложи бедра на тарелку под фольгу на пять минут — сок распределится по мясу.",
      "timerSec": 300
    },
    {
      "id": "s9",
      "title": "Подай",
      "text": "Посыпь кунжутом ({sesame}) и зелёным луком ({green_onion}), дольку лимона — по вкусу. Маринад из-под сырой курицы не используй; если хочется соуса, прокипяти его три минуты и полей."
    }
  ],
  "notes": "Медово-соевый маринад может капать на дно корзины и слегка дымить — это нормально, просто стряхни лишний перед закладкой. Филе бедра без кости и кожи: 190 °C, 15–18 минут, переворот и глазурь в середине. Маринад из-под сырой курицы для глазури не используй — только отложенную треть; после кипячения три минуты он безопасен как соус.",
  "createdAt": "2026-09-11",
  "updatedAt": "2026-09-11",
  "source": "claude-chat"
}
