{
  "schemaVersion": 1,
  "id": "kurinyj-sup-dieticheskij",
  "version": 2,
  "title": "Лёгкий куриный суп с рисом",
  "description": "Суп на втором бульоне, без зажарки и острых специй.",
  "tags": [
    "суп",
    "диетическое",
    "курица"
  ],
  "servings": 4,
  "totalTimeMin": 70,
  "ingredients": [
    {
      "id": "chicken",
      "name": "куриная грудка без кожи и костей",
      "amount": 500,
      "unit": "g"
    },
    {
      "id": "water",
      "name": "вода для бульона",
      "amount": 2,
      "unit": "l"
    },
    {
      "id": "potato",
      "name": "картофель средний",
      "amount": 3,
      "unit": "pcs"
    },
    {
      "id": "carrot",
      "name": "морковь средняя",
      "amount": 1,
      "unit": "pcs"
    },
    {
      "id": "rice",
      "name": "рис круглозёрный",
      "amount": 60,
      "unit": "g"
    },
    {
      "id": "bayleaf",
      "name": "лавровый лист",
      "amount": 1,
      "unit": "pcs",
      "scalable": false
    },
    {
      "id": "salt",
      "name": "соль",
      "amount": 1,
      "unit": "tsp"
    },
    {
      "id": "dill",
      "name": "укроп свежий",
      "unit": "to_taste"
    }
  ],
  "steps": [
    {
      "id": "s1",
      "title": "Первый бульон слить",
      "text": "Положите куриную грудку ({chicken}) в кастрюлю, залейте холодной водой и доведите до кипения. Варите 5 минут, затем слейте воду и ополосните курицу.",
      "timerSec": 300
    },
    {
      "id": "s2",
      "title": "Второй бульон",
      "text": "Залейте курицу свежей водой ({water}), доведите до кипения и варите на слабом огне 30 минут, снимая пену.",
      "timerSec": 1800
    },
    {
      "id": "s3",
      "title": "Овощи и рис",
      "text": "Пока варится бульон, нарежьте картофель ({potato}) кубиками, а морковь ({carrot}) — тонкими кружками. Промойте рис ({rice}) до прозрачной воды.",
      "timerSec": 600
    },
    {
      "id": "s4",
      "title": "Всё вместе",
      "text": "Достаньте курицу, разберите на волокна и верните в кастрюлю. Заложите картофель, морковь и рис, добавьте лавровый лист ({bayleaf}) и варите 15 минут до мягкости картофеля.",
      "timerSec": 900
    },
    {
      "id": "s5",
      "title": "Досолить и подать",
      "text": "Достаньте лавровый лист, посолите ({salt}) и дайте супу постоять под крышкой 10 минут. Подавайте с рубленым укропом ({dill}).",
      "timerSec": 600
    }
  ],
  "notes": "",
  "createdAt": "2026-08-30",
  "updatedAt": "2026-08-30",
  "source": "claude-chat"
}
